{
  "schema": "service-account-usage-v1",
  "serverName": "SYN-APP01",
  "generatedAt": "2026-10-04T09:15:00.0000000+00:00",
  "durationMs": 1840,
  "accounts": ["SYN\\svc_synapp"],
  "scanResult": "Success",
  "sources": { "WindowsServices": "Success", "ScheduledTasks": "Success", "Iis": "Success" },
  "components": [
    { "ComponentType": "IisAppPool", "ComponentName": "SynPool", "Identity": "SYN\\svc_synapp", "MatchedAccount": "SYN\\svc_synapp", "State": null, "Detail": null },
    { "ComponentType": "IisVirtualDirectory", "ComponentName": "SynSite/files", "Identity": "SYN\\svc_synapp", "MatchedAccount": "SYN\\svc_synapp", "State": null, "Detail": "\\\\syn-fs\\share" },
    { "ComponentType": "ScheduledTask", "ComponentName": "\\SynNightly", "Identity": "SYN\\svc_synapp", "MatchedAccount": "SYN\\svc_synapp", "State": "Ready", "Detail": "LogonType=Password" }
  ],
  "verification": null,
  "warnings": []
}
